category,book_name,book_explain,author,publisher,publish_date,price,rate,book_imgurl,keywords,book_type,info_text,num_of_page,topic,probability
슬픔,어쩌면 별들이 너의 슬픔을 가져갈지도 몰라+클래식,김용택의 필사해서 간직하고 싶은 한국 대표 시 (감성치유 라이팅북),김용택 저자(글),위즈덤하우스,2017년 6월 29일,"12,420원",9.81,https://contents.kyobobook.co.kr/sih/fit-in/200x0/pdt/9788959135301.jpg,임화 한국현대시 오장환 필사 김영랑 한국 대표 시인,시/에세이,"언제 읽어도 감동적인 한국 대표 작가들의 명시를 읽고 쓰는 즐거움!. tvN 드라마 ‘도깨비’에 등장하며 시를 필사하는 즐거움을 알려준 《어쩌면 별들이 너의 슬픔을 가져갈지도 몰라》의 진한 감동을 이어가는 『어쩌면 별들이 너의 슬픔을 가져갈지도 몰라+ 클래식』. 클래식이라는 이름답게 윤동주, 김소월, 김영랑, 백석 등 한국인이 사랑하는 시인의 작품과 임화, 오장환, 노자영 등 김용택 시인이 아끼는 작가의 숨겨진 보석 같은 시까지 한국의 대표 명시 113편을 만나볼 수 있다.감성적인 디자인과 다채로운 콘텐츠가 눈길을 사로잡는 이 책에 담긴 평생 간직하고 싶은 시 113편은 손으로 필사하며 마음에 새기는 즐거움을, 시의 아름다움을 재발견하는 기쁨을 선사한다. 시대를 막론하고 오랫동안 사랑받는 시에는 변치 않는 아름다움이 있다. 오랜 세월 많은 이들에게 잔잔한 위로를 건네던 시를 담은 이 책을 통해 클래식 작품의 힘을 느끼고 감동과 여운을 느낄 수 있다.",296쪽,Topic #1,0.808327777245699
슬픔,너의 슬픔이 끼어들 때,안희연 시집 (창비시선  393),안희연 저자(글),창비,2015년 9월 30일,"9,900원",9.72,https://contents.kyobobook.co.kr/sih/fit-in/200x0/pdt/9788936423933.jpg,한국시 몽유 화산섬 현대시 총알 내정,시/에세이,"안희연 시인의 첫 시집 『너의 슬픔이 끼어들 때』. 시인은 세계의 소멸과 존재의 몰락이 진행되는 가장 어두운 세계를 하루하루 살아내야 하는 자의 통증에 대해 쓴다. 사라지는 세계 속에서 사라지고 있는 사람은 어떻게 살아가야 하는가. “내정된 실패의 세계 속에 우리는 있다”(「기타는 총, 노래는 총알」)고 시인은 단언하지만, 그럼에도 우리는 노래할 수 있고, 함께할 수 있다고 이야기하는 찬란한 목소리는 묵직한 울림을 만들어낸다.",160쪽,Topic #1,0.7001725274828187
슬픔,소망 없는 불행,(세계문학전집  65),"페터 한트케 저자(글), 윤용호 번역",민음사,2002년 6월 15일,"9,000원",9.55,https://contents.kyobobook.co.kr/sih/fit-in/200x0/pdt/9788937460654.jpg,세계고전문학 노벨문학상 글쓰기 아이 이야기 어머니 독일소설,소설,"페터 한트케의 치열한 작가 정신을 엿보다!. 2019년 노벨문학상 수상작가 페터 한트케의 소설 『소망 없는 불행』. 1966년 첫 소설 《말벌들》과 첫 희곡 《관객모독》을 발표한 이래 시, 시나리오, 논문 등 가릴 것 없이 왕성한 창작 활동을 펼쳐온 저자가 1972년 발표한 《소망 없는 불행》과 1981년 발표한 《아이 이야기》를 묶은 책으로, 저자가 언어 실험적 글쓰기를 극복하고 전통적 서술 방식을 차용하여 문학의 서정성을 회복했다는 평가를 받은 작품들을 만나볼 수 있다. 어머니의 자살을 이야기하는 《소망 없는 불행》에서는 결코 눈물을 쏟아내지 않지만 두 눈에 절망을 꾹꾹 눌러 넣은 듯한 단단한 질감의 슬픔이, 낯선 곳에서 아이 키우기란 자신의 일상적 삶을 비교적 담담한 문체로 기록한 《아이 이야기》에서는 여러 인간관계에서 폐쇄적인 성향을 가진 저자가 아이를 키우며 이웃과 크고 작은 관계를 형성하면서 세계와 화해해 가는 과정이 읽는 이에게 직접적으로 체감되는 놀라운 경험을 하게 된다.. 저자만의 독보적인 경지를 이루고 있는 날카로운 관찰과 눈부시게 반짝이는 시적 묘사 등을 엿볼 수 있는 두 작품은 대략 10년의 시차를 두고 쓴 작품이지만, 저자의 주제 의식과 관련하여 볼 때 가장 전형적인 작품이며 작가로서의 발전에서 중요한 위치를 점하는 작품이라고 평가받고 있다.",190쪽,Topic #1,0.8295853491377545
슬픔,슬픔이 설렘이 될 때까지,여기가 끝이 아니라 다시 살아갑니다,이영란 저자(글),미다스북스,2023년 10월 20일,"21,000원",10.0,https://contents.kyobobook.co.kr/sih/fit-in/200x0/pdt/9791169103510.jpg,남편 서약서 모녀 백년해로 속앓이 무한 반복,시/에세이,"“가족 상실을 극복하는세 모녀의 희망과 성장의 기록!” “내가 정신 못 차려 이런 일이 생겼나?”“엄마, 내가 좀 이상해요”곪아 터진 가슴을 세상에 꺼내며묵직한 위로와 응원을 세상에 전한다준비 없는 이별을 맞이한세 모녀의 상처 극복 성장 스토리!. 이 책은 아무런 준비 없이 다가온 가장의 과로사가 남아있는 가족의 일상을 어떻게 뒤흔들 수 있는지 사실적으로 보여준다. 더불어 그 흔들림 속에서 어떻게 서로를 보듬으며 회복하고 있는지 현재 진행형의 희망과 절망의 무한 반복을 담담하게 이야기하고 있다.저자는 결혼식에서 검은 머리 파 뿌리가 될 때까지 사랑 변치 않고 잘 살겠노라 서약서를 썼다. 그렇게 장수 만만세를 외치며 백년해로를 기대했지만, 인생이 서약서 대로 되지 않는다는 것을 결혼 18년 만에 알게 됐다.불 꺼지지 않는 세종청사에서 야근과 주말 근무를 일상으로 삼던 성실하고 책임감 강했던 평범한 가장, 속 한 번 썩인 적 없는 효자, 다정한 아빠였던 남편. 남편이라는 기둥이 무너지던 날, 필자를 비롯한 가족 모두가 어둠 속에서 길을 잃었다.남편이 미처 말하지 못했던 속앓이와 고충들을 세상 밖으로 꺼내 보이고 싶던 필자는 기꺼이 그를 위해 두 손을 빌려주기로 했다. 그간 누구보다 열심히 살아온 남편의 마지막을 헛된 죽음으로 남기고 싶지 않았던 필자의 마음을 이 한 권에서 고스란히 느낄 수 있을 것이다.",296쪽,Topic #3,0.8293089116934298
슬픔,슬픔은 어떻게 글이 되는가,용기 있게 나를 마주하는 글쓰기 수업,김소민 저자(글),스테이블,2023년 7월 10일,"15,120원",10.0,https://contents.kyobobook.co.kr/sih/fit-in/200x0/pdt/9791197393280.jpg,글쓰기 수업 소민 따귀 상처 연대 부사,인문,"“삶에서 글쓰기가 필요한 순간은 누구에게나 있다”글쓰기 노동자 김소민이 전하는 쓰는 행위가 가진 치유와 연대의 의미, 그리고 방법론. 개인의 일상이 그 어느 때보다 적극적으로 기록되는 시대다. 블로그, 소셜미디어 등을 통해 평범한 하루하루부터 특별함 체험까지 자발적으로 자신을 드러내는 이들이 넘쳐난다. 열쇠고리로 꼭꼭 잠그고 나만 보던 일기장의 시간은 가고, 이제는 자신의 콘텐츠로 타인과 소통하기를 원하는 이들이 자리한다. 그런데 문득 궁금해진다. 이런 기록은 어떤 의미가 있는 걸까?     《슬픔은 어떻게 글이 되는가》는 한겨레신문사에서 13년 간 기자로 일했던 저자 김소민이 쓴 글쓰기에 대한 책이다. 저자는 신문사에서 “글쓰기를 영혼의 따귀를 맞아가며 배”웠던 터라 자발적으로 글을 쓰고자 하는 사람들이 처음에는 신기했다. 그에게 글쓰기란 밥벌이이자 두려움, 끝없는 배움과 질투로 뒤섞인 복잡한 존재였기 때문이다. 그러다 한겨레문화센터에서 ‘내 이야기 하나쯤’이라는 수업을 진행하고 다양한 개인의 경험, 그중에서도 슬픔이나 분노, 트라우마처럼 감정적인 상황이 글로 엮여 ‘상처가 상처로 끝나지 않는 마법’을 본 후 깨달았다. 각자의 이야기는 모두 쓰일 가치가 있고, 누군가 그 글을 읽는 것만으로 세상은 넓어지고 서로 기댈 수 있다고.    이 책은 기자로 시작해 여전히 글쓰기 노동자로 살아가는 한 사람의 솔직하고 내밀한 ‘자전적 글쓰기 성장담’이자, 그가 전하는 ‘쓰는 행위가 가진 치유와 연대의 힘, 그리고 방법론’을 담은 책이다. 저자는 개인이 가진 저마다의 경험을 어떻게 감각하고 글로 정리할 것인지 놀랄 만큼 솔직한 자신의 에피소드와 다양한 예시로 방향성을 일러준다. 특히 힘든 상황에 내몰렸을 때 이를 글로 풀어내 감정과 거리를 두고 자신의 상처에 자문하며 성장할 수 있는 방법을 모색한다. 글의 주제 고르기부터 조사나 부사 사용 등 문장에 대한 기본적인 원칙도 함께 담았으며, 부록에서는 저자가 글쓰기 수업 중 만난 빛나는 일곱 편의 에세이를 읽어볼 수 있다.    독자들은 이 책을 통해 ‘내 이야기가 중요할까?’ ‘누가 이 이야기에 관심을 가질까?’라는 질문에 답을 찾고, 자신의 이야기를 세상에 완성도 있게 드러내는 데 도움을 얻을 수 있을 것이다.",252쪽,Topic #3,0.8457009922586407
슬픔,원래 그런 슬픔은 없다,허찬욱 에세이,허찬욱 저자(글),생활성서사,2023년 6월 24일,"11,700원",9.38,https://contents.kyobobook.co.kr/sih/fit-in/200x0/pdt/9788984816404.jpg,위로 시작점 책머리 변증법 애도 마일스,시/에세이,"문학과 음악, 영화에서 길어 올린 슬픔 이야기. 문학과 음악, 영화와 미술이라는 다양한 우물에서 길어 올린 22편의 에세이. 슬픔과 고통에 관한 성찰을 담은 이 책은 타인의 슬픔을 이해하려는 이에게 도움이 되고, 그리고 슬퍼하는 이에게는 작은 위로가 될 것이다. 무엇보다 유연하고 넓은 사유를 갈망하는 독자들의 갈증을 달래줄 것이다. “슬퍼하는 방식이 사람마다 다르니, 타인의 슬픔을 이해하는 일은 타인을 마주할 때마다 매번 새로이 시작해야 하는 일입니다. 타인의 슬픔을 온전히 이해하기가 힘들다는 것, 힘든 것을 넘어 거의 불가능에 가깝다는 것을 인정하는 순간이 타인을 이해하는 일의 시작점이라 믿습니다.”  -‘책머리에’ 중에서",216쪽,Topic #3,0.8062505443661404
슬픔,이중언어의 기쁨과 슬픔,한 언어심리학자의 자아 상실과 회복에 관한 이야기,"줄리 세디비 저자(글), 김혜림 번역",지와사랑,2023년 4월 19일,"17,100원",10.0,https://contents.kyobobook.co.kr/sih/fit-in/200x0/pdt/9788989007982.jpg,체코어 모국어 외국어 학습 에세 이스트 이중성 소수 민족,인문,"『이중언어의 기쁨과 슬픔』을 쓴 저자 줄리 세디비는 언어심리학자다. 체코슬로바키아에서 태어나 두 살 때까지 그곳에 머물다가, 오스트리아와 이탈리아를 거쳐 캐나다 몬트리올로 가족 모두가 이주했다. 인간이 가장 극적으로 변화하는 유년기에 이렇듯 다채로운 언어를 온몸으로 통과해낸 저자는 운명처럼 언어심리학에 이끌렸다. 그중에서도 체코어는 그녀의 모국어로서 특별한 의미를 지닌다. 캐나다에 정착한 이후 ‘주류 언어’인 영어를 배우기 시작하면서 ‘비주류 언어’이자 ‘이민자의 언어’인 체코어는 자연스레 뒷전으로 밀렸고, 어느새 기억 저편으로 사라져버렸다. 체코어의 죽음을 애도하는 일은 그녀의 아버지가 고향 땅에서 숨을 거둔 후부터 시작되었다. 이 책은 그리하여 모국어 상실의 메커니즘과 언어 간의 권력관계를 탐구하는, 동시에 수없이 스러져간 소수민족들의 ‘약한 언어’ 위로 수북이 쌓인 먼지를 털어내는, 애도 일기에 다름 아니다. 책 전반에 걸쳐 저자는 언어심리에 관한 다양한 질문에 답한다. 모국어와 제2언어가 자아를 사이좋게 나눠 가질까? 왜 성인은 어린 아이보다 외국어 학습에 더딘가? 만약 이중언어를 사용한다면 자아도 두 개로 나뉘게 될까? 혹시, 우리의 머릿속에서 두 언어가 주인공 자리를 두고 다투는 건 아닐까? 그러다 더 힘이 센 언어가 더 약한 언어를 밀어내고, 그것도 아주 영영 밀어내고, 한 가지 언어로만 말하게 될 수도 있을까? 이를 설명하기 위해 저자가 가져오는 사례들은 무척 흥미롭다. 그러나 이 책의 가장 큰 장점은, 언뜻 딱딱하게 느껴질 수 있는 언어심리의 기제를 에세이스트의 목소리로 일상의 언어를 사용하여 풀어낸다는 것이다. 독자는 모국어에서 떠나 방황하다가 결국 그것을 되찾고 평온에 이르는 저자의 삶 한 조각을 따라 걷게 될 것이다. 그래서 책은 크게 죽음-꿈-이중성-갈등-회복-고향으로 구성되며, 각 부에서 그와 관련한 저자의 이야기 및 세계 각지의 사례와 연구 결과를 만나게 된다.",344쪽,Topic #2,0.7795821066330226
슬픔,우리 슬픔의 거울,피에르 르메트르 장편소설,"피에르 르메트르 저자(글), 임호경 번역",열린책들,2023년 4월 10일,"16,920원",10.0,https://contents.kyobobook.co.kr/sih/fit-in/200x0/pdt/9788932923086.jpg,포로 블랙 유머 부작 거대 권력 르 피가로 프랑스 문단,소설,"현존하는 가장 재미있는 거장이자 공쿠르상 수상 작가인 피에르 르메트르가 내놓은 신작 장편소설. 제2차 세계 대전을 배경으로 하는 이 소설은 전쟁의 참화 속에서 서로 기구하게 뒤얽히는 여러 인물들의 이야기를 아이러니한 유머로 펼쳐 보인다. 『오르부아르』, 『화재의 색』을 잇는 이 작품은 20세기 역사를 다룬 3부작의 대미로, 이 3부작은 전 세계 360만 부 판매되고, 29개 언어로 번역되었다.옷을 벗어 달라는 제안을 받은 교사, 비밀이 든 가방을 들고 다니는 헌병, 전선에서 도망치다 붙들린 군인……. 이들은 자기도 모르는 새에 뒤틀려 버린 삶을 전쟁 통을 가로지며 바로잡는다. 소설은 전쟁의 참상을 보여 주는 한편으로, 끊임없이 코미디 같은 상황을 연출함으로써 독자들에게 〈웃긴 동시에 기가 막히는〉 아이러니한 감정과 몰입감을 선사한다. 유수 언론에서 〈기교와 블랙 유머의 결정체〉, 〈악마 같은 플롯을 지닌 책!〉이라는 극찬을 받은 이 작품을 통해 독자들은 소설이라는 장르에서 맛볼 수 있는 최고의 재미와 쾌감을 경험할 수 있을 것이다.",628쪽,Topic #1,0.8203630241549635
슬픔,레몬 케이크의 특별한 슬픔,에이미 벤더 장편소설,"에이미 벤더 저자(글), 황근하 번역",멜라이트,2023년 3월 15일,"15,300원",9.88,https://contents.kyobobook.co.kr/sih/fit-in/200x0/pdt/9791198030726.jpg,장편소설 연애 감정 비밀 아빠 크림치즈 요리,소설,"“나는 사람들이 스스로도 깨닫지 못하는 감정을 맛으로 느낄 수 있어”. 삼월의 어느 따뜻한 봄날 오후, 학교를 마치고 돌아온 로즈에게 엄마는 먹음직스러운 레몬 초코 케이크를 구워준다. 향긋하고 진한 풍미의 케이크를 한 입 가득 입에 넣은 로즈. 최고급 초콜릿과 신선한 레몬 같은 재료들 아래에 숨어 있던 맛, 즉 엄마의 “부재, 굶주림, 소용돌이, 텅 빔의 맛”을 느끼고 충격을 받는다. 곧 무언가를 먹으면 그것을 요리한 사람의 감정이 고스란히 느껴지는, 특별한 능력 아닌 능력을 갖게 된 아홉 살 로즈. 화가 난 쿠키, 지쳐 있는 우유, 사랑해달라고 소리치는 샌드위치 등 모든 음식에서 감정을 느끼며 살아간다. 그리고 곧 상상할 수도 없었던 진실과 마주하게 되는데……. 비밀스러운 능력을 가진 소녀의 성장통과 그 가족의 이야기를 독창적인 상상력과 예민한 감성으로 그려낸 에이미 벤더의 장편소설 《레몬 케이크의 특별한 슬픔》은, 가장 가까운 관계에서 더욱 필요한 이해와 인간의 감정 그 이면을 섬세하게 탐구하며 예기치 못한 삶의 비밀을 깨닫는 놀라운 경험을 선사한다.",404쪽,Topic #3,0.8292105531079378
슬픔,한 개의 기쁨이 천 개의 슬픔을 이긴다: 일과 선택에 관하여,(조우성 변호사 에세이  2),조우성 저자(글),서삼독,2022년 7월 7일,"13,320원",9.94,https://contents.kyobobook.co.kr/sih/fit-in/200x0/pdt/9791165345112.jpg,,시/에세이,"25년차 변호사가 직접 보고 듣고 겪은, 드라마보다 더 드라마 같은 인생 이야기를 담은 책이다. 실제 스토리를 바탕으로 진한 여운을 선사하는 드라마형 에세이로 총 2권으로 나누어 세상에 선을 보인다.1권 ‘삶과 태도’ 편은 우리가 어떤 관계 속에서 살아왔는지를 돌아보게 하고, 앞으로 어떤 관계 속에서 살아가야 하는지를 깨닫게 한다. 2권 ‘일과 선택’ 편은 가족, 동료, 이웃과의 소소한 다툼부터 비즈니스 협상까지 누구나 겪는 갈등과 선택의 상황을 분쟁과 후회 없이 해결해가는 흥미진진한 에피소드와 지략을 담아냈다.  이 책은 이야기 하나하나의 농밀함이 짙어 마치 단편드라마를 보는 듯 높은 완성도를 보인다. 자신의 아들을 직접 경찰서에 신고한 아버지의 사연, 수십 년간 존경해온 남편의 충격적인 실체에 맞닥뜨린 어느 부인의 이야기, 좋은 마음으로 5만원 택시비를 쥐어줬다가 1억 4천만원을 잃게 된 기막힌 스토리 등, 반전의 반전을 거듭하는 인생의 묘미와 다채로운 희로애락의 소용돌이가 응축되어 있다. 드라마 〈이상한 변호사 우영우〉의 에피소드 사건의 원작으로 일부 사용되었다.",312쪽,Topic #2,0.8223982016841965
슬픔,"읽는 슬픔, 말하는 사랑",우리가 시를 읽으며 나누는 마흔아홉 번의 대화,황인찬 저자(글),안온북스,2022년 4월 27일,"14,400원",9.46,https://contents.kyobobook.co.kr/sih/fit-in/200x0/pdt/9791197504198.jpg,타인 박서영 삶 혼자 성찰 유종인,시/에세이,"시를 읽기, 슬픔을 말하기, 사랑을 발견하기,그리하여 더 나은 사람으로 성장하기. 황인찬 시인의 산문집 《읽는 슬픔, 말하는 사랑》이 안온북스에서 출간되었다. 《읽는 슬픔, 말하는 사랑》은 김수영문학상, 현대문학상 등을 수상하며 독자와 평단의 사랑을 폭넓게 받은 시인의 첫 산문집으로, 네이버 오디오클립 ‘황인찬의 읽고 쓰는 삶’에 연재된 콘텐츠를 선별하여 엮었다. 시인은 친절한 목소리로 마흔아홉 편의 시를 읽고, 세심한 태도로 수많은 슬픔을 헤아린다. 타인의 슬픔을 짐작하며 거기에서 사랑을 발견한다. 사랑은 다를 수밖에 없는 너와 나를 잠시나마 하나일 수 있게 한다. 그것은 타인의 삶과 맞닿는 순간이다. 그렇게 우리는 시를 통해 성장한다. 시를 통해 우리는 함께 읽고 함께 생각하며 함께 살아갈 수 있는 것이다.작가의 시들은 하나같이 따듯한 말을 건넨다. 혼자여도 괜찮을 거라고. 세계의 알 수 없음을 되돌아보되, 그걸 꼭 다 알아야 할 필요는 없다고 말한다. 주변 사람에게 안부를 물으며 고맙다는 말을 아끼지 말라 조언하며, 당신의 혼잣말조차 깊은 소통의 결과일지 모른다고 말한다. 슬픔을 안은 채로 성장할 수 있다면, 깊은 슬픔조차도 꽤 괜찮은 것이라 일러준다. 이러한 일은 시가 타인의 슬픔을 담고 있기에 가능하다. 시는 혼자여서 슬픈 사람을 발견하고 도무지 알 수 없는 무언가가 일으키는 노심초사를 이해한다. 마음에만 품고서 전하지 못하는 말들의 무게를 알고, 타인에게 마음을 전할 용기를 북돋는다. 따듯한 말이 가능하기 위해서 필요한 건 슬픔이었다. 시에는 혼자이기에 슬픈 사람이 있고 당신의 마음을 알 수 없어 슬픈 청춘이 있다. 너무 늦어 꼭 전해야 했을 말을 속으로만 삼킨 이들이 있고, 그 말들을 혼자 되뇌며 후회하는 존재가 있다. 작가는 시를 읽음으로써 그들의 슬픔을 읽는다. 슬픔을 읽음으로써 그들의 삶에 닿는다. 그 삶에는 나와 다른 당신이 존재한다. 이제, 여기에 실린 시와 산문을 통해 당신의 존재를 읽고 말할 차례다.",308쪽,Topic #3,0.8293135875817366
슬픔,슬픔 이후의 슬픔,상실의 아픔과 함께 삶으로 나아가는 법,"호프 에덜먼 저자(글), 김재경 번역",다산북스,2022년 1월 4일,"16,200원",10.0,https://contents.kyobobook.co.kr/sih/fit-in/200x0/pdt/9791130679396.jpg,죽음 감정 애도 상실 심층 인터뷰 치유,인문,"끝나지 않는 애도에 관한 깊고도 다정한 통찰뉴욕타임스 베스트셀러 작가가 들려주는 애도 수업..상실의 슬픔을 이해하지 않고서는 삶을 이해할 수 없다. 『슬픔 이후의 슬픔』에서 저자는 사랑하는 이와의 사별로 인한 슬픔은 결코 사라지거나 끝낼 수 있는 종류의 감정이 아니며 그것을 억지로 극복하거나 없애려고 노력하지 않아도 된다고, 그래서는 안 된다고 주장한다. 오래도록 표출되지 못한 사별의 아픔은 도리어 공중보건에 심각한 위기를 초래할 수 있다고 경고하는 저자는 10대 시절에 어머니를, 20대 때 아버지를 잃은 자신의 경험과 그동안 겪어온 감정을 세심하게 돌아보며 자기 고백을 털어놓는 동시에 오래전 사별을 경험한 사람들 100명 이상과의 심층 인터뷰를 통해 수많은 상실을 들여다본다. 더불어 슬픔과 애도에 관한 다양한 학술 연구를 폭넓게 아우르는 것도 잊지 않는다. 또한 어떻게 하면 우리가 사랑하는 사람의 죽음을 있는 그대로 받아들이고 그에 따른 슬픔을 정면으로 마주할 수 있을지, 거대하고도 깊은 상실의 슬픔을 끌어안으면서도 보다 건강하게 삶을 지속해나갈 수 있을지를 탐구한다. 온 힘을 다해 상실과 애도를 이해하려는 저자의 끈질기고도 절박한 사투는 독자들로 하여금 사별로 인한 슬픔이 ‘비정상’도 ‘질병’도 아닌 자연스러운 감정이며 오히려 인간을 인간답게 만들어주는 특성임을 자연스럽게 이해하도록 돕는다. 나아가 그 슬픔을 통해 성장하고 미래를 향해 전진할 수 있으리라는 확신까지 전한다. 《슬픔 이후의 슬픔》은 2022년 코로나로 인한 거대한 상실의 흐름 한가운데 서 있는 많은 독자들에게 슬픔에 대한 깊은 통찰과 다정한 위로를 동시에 선사해줄 것이다.",440쪽,Topic #3,0.8412511949706553
슬픔,슬픔도 태도가 된다,전영관 시집 (문학동네시인선  141),전영관 저자(글),문학동네,2020년 6월 29일,"9,000원",10.0,https://contents.kyobobook.co.kr/sih/fit-in/200x0/pdt/9788954672993.jpg,한국시 시 제목 섬망 현대시 가족 회진,시/에세이,"2011년 『작가세계』 신인상을 받으며 작품 활동을 시작한 전영관 시인의 세번째 시집을 선보인다. 『부르면 제일 먼저 돌아보는』 이후 4년 만이다. 2015년 뇌졸중으로 죽음의 문턱까지 갔던 시인은, ‘차가움과 뜨거움을 통증으로 착각하는 왼손’을 주무르며 한 손으로 시를 써내려갔다. ‘회진’ ‘처방전’ ‘후유증’ ‘섬망’ ‘요양’에서부터 ‘구름 감별사’ ‘허밍’ ‘와온’까지, 60편의 시 제목들에서부터 그의 실제와 꿈, 현실과 지향점이 짐작된다.",144쪽,Topic #2,0.7825836873529842
슬픔,슬픔만한 거름이 어디 있으랴,(실천시선  57),허수경 저자(글),실천문학사,2010년 5월 17일,"9,000원",9.84,https://contents.kyobobook.co.kr/sih/fit-in/200x0/pdt/9788939206328.jpg,저물녘 대평 송기원 지붕 아래 남강 항소 이유,시/에세이,"상상력과 여성성의 시어들로 빚어져 희망의 언어가 담긴 허수경 시집 『슬픔만 한 거름이 어디 있으랴』. 토속적인 문체로 사랑과 기다림, 그리움을 노래한 `진주 저물 녘`을 비롯하여 `폐병쟁이 든 내 사내` 등 허수경의 시를 총 4부로 나누어 수록했다. 감성적이고 세련된 언어로 다양한 이야기를 전해온 허수경시인은 이번 시집에서 크고 깊은 고통과 몸부림이 담긴 사랑의 이야기를 펼쳐낸다.. ☞ 이 책에 담긴 시 한 편진주 저물녘기다림이사 천년 같제 날이 저물셰라 강바람 눈에 그리메지며 귓불 불콰하게 망경산 오르면 잇몸 드러내고 휘모리로 감겨가는 물결아 지겹도록 정이 든 고향 찾아올리 없는 고향문디 같아 반푼이 같아서 기다림으로 너른 강에 불씨 재우는 남녘 가시나주막이라도 차릴거나승냥이와 싸우다 온 이녁들 살붙이보다 헌칠한 이녁들 거두어나지고밤꽃처럼 후두둑 피어나지고",162쪽,Topic #2,0.7352158691753217
